MCQ,Choices,Correct
What is the basic unit of life in biology?,a: Atoms | b: Molecules | c: Cells | d: Organs,c
Which scientist first articulated the theory of evolution by natural selection?,a: Isaac Newton | b: Gregor Mendel | c: Charles Darwin | d: Louis Pasteur,c
What is the basis of inheritance in biology?,a: Genes and heredity | b: Evolution | c: Energy transformation | d: Homeostasis,a
Which field of biology studies the interaction of organisms with their environments?,a: Physiology | b: Ecology | c: Evolutionary biology | d: Developmental biology,b
What is the scientific study of life and living organisms called?,a: Chemistry | b: Geology | c: Biology | d: Physics,c
